                                             Experiment No:4
                   
                                             DML COMAND-UPDATE
---------------------------------------------------------------------------------------------------------
---------------------------------------------------------------------------------------------------------
---------------------------------------------------------------------------------------------------------

QUESTION :1

Exp4 : DML COMMAND- UPDATE

Update the price of a particular product.

Query:

mysql> update product set price='300' where pid=104;  //MENTION THE PRODUCT NAME LIKE 'PEN'
Query OK, 1 row affected (0.04 sec)
Rows matched: 1  Changed: 1  Warnings: 0

mysql> select * from product;
+-----+--------+--------+
| pid | pname  | price  |
+-----+--------+--------+
| 101 | book   |  55.00 |
| 102 | pen    |  15.00 |
| 103 | bag    | 500.00 |
| 104 | box    | 300.00 |
| 105 | sheo   | 750.00 |
| 106 | pencil |  10.00 |
+-----+--------+--------+
6 rows in set (0.00 sec)


--------------------------------------------------------------------------------------------------------

QUESTION :2


Change the name of city ‘calicut’ to ‘kozhikode’ in the customer table.


Query:

mysql>update customer set city='kozhikode' where id=1; // WRONG
Query OK, 1 row affected (0.04 sec)

mysql> select * from customer;
+----+-------+---------------+-----------+-----------+
| id | name  | address       | city      | ph_no     |
+----+-------+---------------+-----------+-----------+
|  1 | jan   | bluemoon      | kozhikode | 987654321 |
|  2 | sanam | rayyan valley | tvm       |  56439321 |
|  3 | emir  | baithul hubb  | ekm       |  56439321 |
|  4 | anulf | baithul       | tsy       |      NULL |
|  5 | irfan | sanam         | calicut   | 234523455 |
+----+-------+---------------+-----------+-----------+
5 rows in set (0.00 sec)

---------------------------------------------------------------------------------------------------------

QUESTION :3


Update all prices with 2% of its original price.

Query:

mysql> update product set price=price+(0.02*100);
Query OK, 6 rows affected (0.04 sec)

mysql> select * from product; 

+-----+--------+--------+
| pid | pname  | price  |
+-----+--------+--------+
| 101 | book   |  57.00 |
| 102 | pen    |  17.00 |
| 103 | bag    | 502.00 |
| 104 | box    | 302.00 |
| 105 | sheo   | 752.00 |
| 106 | pencil |  12.00 |
+-----+--------+--------+
6 rows in set (0.01 sec)

--------------------------------------------------------------------------------------------------------
QUESTION :4


Change the address, city, phone number of a particular customer.

Query:

mysql> update customer set address='manzil' ,city='kochi', ph_no='98765432' where id=4;
Query OK, 1 row affected (0.04 sec)

mysql> select * from customer; 
 
+----+-------+---------------+-----------+-----------+
| id | name  | address       | city      | ph_no     |
+----+-------+---------------+-----------+-----------+
|  1 | jan   | bluemoon      | kozhikode | 987654321 |
|  2 | sanam | rayyan valley | tvm       |  56439321 |
|  3 | emir  | baithul hubb  | ekm       |  56439321 |
|  4 | anulf | manzil        | kochi     |  98765432 |
|  5 | irfan | sanam         | calicut   | 234523455 |
+----+-------+---------------+-----------+-----------+
5 rows in set (0.00 sec)

--------------------------------------------------------------------------------------------------------

QUESTION :5


Change the quantity of a purchased product of inv_id ‘1001’


Query:

mysql> update invoice_item set quantity=18 where inv_id=1001;  //WRONG..PRODUCT ID NEEDED IN CONDITION
Query OK, 1 row affected (0.04 sec)

mysql> select * from invoice_item;

                    
+--------+------+----------+
| inv_id | pid  | quantity |
+--------+------+----------+
|   1001 |  101 |       18 |
|   1002 |  102 |        5 |
|   1003 |  103 |        2 |
|   1003 |  102 |        3 |
|   1003 |  101 |        2 |
|   1004 |  106 |       10 |
|   1005 |  105 |        1 |
|   1002 |  104 |        2 |
|   1006 |  102 |        2 |
|   1006 |  101 |        2 |
+--------+------+----------+
10 rows in set (0.00 sec)


//CORRECT THE ABOVE QUERIES
